{
  "cursor_sample_id": "real-5bb839e41268104ef712c43a",
  "events": [
    {
      "action": "nomination",
      "previous_label": null,
      "previous_nomination": null,
      "previous_skip": null,
      "sample_id": "real-v2-08b5dac6329894327618dbf8"
    },
    {
      "action": "nomination",
      "previous_label": null,
      "previous_nomination": null,
      "previous_skip": null,
      "sample_id": "real-v2-1072a251e26bb796169995e8"
    },
    {
      "action": "label",
      "previous_label": null,
      "previous_nomination": {
        "annotator": "local-reviewer",
        "provenance": "human_stage_0_review",
        "sample_sha256": "936208d0b5f365928bd50cbae79d51ade56f70fde3dd131c2b512e2781c44f1e",
        "status": "VALID_TARGET",
        "timestamp_utc": "2026-10-06T16:13:39.660415+00:00"
      },
      "previous_skip": null,
      "sample_id": "real-v2-1072a251e26bb796169995e8"
    },
    {
      "action": "nomination",
      "previous_label": null,
      "previous_nomination": null,
      "previous_skip": null,
      "sample_id": "real-v2-111b210d237267767721c962"
    },
    {
      "action": "nomination",
      "previous_label": null,
      "previous_nomination": {
        "annotator": "local-reviewer",
        "provenance": "human_stage_0_review",
        "sample_sha256": "354f623a6ca8a8794435a63d9a0e8f7c7828038b175da1be0984283b4b4af2d2",
        "status": "VALID_TARGET",
        "timestamp_utc": "2026-10-06T16:13:53.756800+00:00"
      },
      "previous_skip": null,
      "sample_id": "real-v2-111b210d237267767721c962"
    },
    {
      "action": "nomination",
      "previous_label": null,
      "previous_nomination": {
        "annotator": "local-reviewer",
        "provenance": "human_stage_0_review",
        "sample_sha256": "354f623a6ca8a8794435a63d9a0e8f7c7828038b175da1be0984283b4b4af2d2",
        "status": "VALID_TARGET",
        "timestamp_utc": "2026-10-06T16:17:20.596968+00:00"
      },
      "previous_skip": null,
      "sample_id": "real-v2-111b210d237267767721c962"
    },
    {
      "action": "label",
      "previous_label": null,
      "previous_nomination": {
        "annotator": "local-reviewer",
        "provenance": "human_stage_0_review",
        "sample_sha256": "354f623a6ca8a8794435a63d9a0e8f7c7828038b175da1be0984283b4b4af2d2",
        "status": "VALID_TARGET",
        "timestamp_utc": "2026-10-06T16:17:22.575173+00:00"
      },
      "previous_skip": null,
      "sample_id": "real-v2-111b210d237267767721c962"
    },
    {
      "action": "nomination",
      "previous_label": null,
      "previous_nomination": null,
      "previous_skip": null,
      "sample_id": "real-v2-06f44feeb4f23a6ade8c6389"
    },
    {
      "action": "label",
      "previous_label": null,
      "previous_nomination": {
        "annotator": "local-reviewer",
        "provenance": "human_stage_0_review",
        "sample_sha256": "0be87730816d1c4cc9baa5a8b0ef77c8b038b2840c43627ac38fb3da78b14a55",
        "status": "VALID_TARGET",
        "timestamp_utc": "2026-10-06T16:17:25.773122+00:00"
      },
      "previous_skip": null,
      "sample_id": "real-v2-06f44feeb4f23a6ade8c6389"
    },
    {
      "action": "nomination",
      "previous_label": null,
      "previous_nomination": null,
      "previous_skip": null,
      "sample_id": "real-v2-200fe191becfb38e5c171017"
    },
    {
      "action": "label",
      "previous_label": null,
      "previous_nomination": {
        "annotator": "local-reviewer",
        "provenance": "human_stage_0_review",
        "sample_sha256": "10258265ed72c92a8405f3065b24cbc8e3fb6adaa51c2a976a0498a0cc471688",
        "status": "VALID_TARGET",
        "timestamp_utc": "2026-10-06T16:17:30.260820+00:00"
      },
      "previous_skip": null,
      "sample_id": "real-v2-200fe191becfb38e5c171017"
    },
    {
      "action": "nomination",
      "previous_label": null,
      "previous_nomination": null,
      "previous_skip": null,
      "sample_id": "real-v2-09b7dfce230ff7917a0f9750"
    },
    {
      "action": "label",
      "previous_label": null,
      "previous_nomination": {
        "annotator": "local-reviewer",
        "provenance": "human_stage_0_review",
        "sample_sha256": "27eaf899fea17664fc899bd90e3826da6e1a6dd3155d1ad00fc335f0fe84784c",
        "status": "VALID_TARGET",
        "timestamp_utc": "2026-10-06T16:17:32.245710+00:00"
      },
      "previous_skip": null,
      "sample_id": "real-v2-09b7dfce230ff7917a0f9750"
    },
    {
      "action": "nomination",
      "previous_label": null,
      "previous_nomination": null,
      "previous_skip": null,
      "sample_id": "real-v2-0679bf07b146ac6589db9f29"
    },
    {
      "action": "label",
      "previous_label": null,
      "previous_nomination": {
        "annotator": "local-reviewer",
        "provenance": "human_stage_0_review",
        "sample_sha256": "1fdb8cbb19ac8e4672472692e6335102e16ff5ec6ff741c625cf95994a087c8c",
        "status": "VALID_TARGET",
        "timestamp_utc": "2026-10-06T16:17:35.260956+00:00"
      },
      "previous_skip": null,
      "sample_id": "real-v2-0679bf07b146ac6589db9f29"
    },
    {
      "action": "nomination",
      "previous_label": null,
      "previous_nomination": null,
      "previous_skip": null,
      "sample_id": "real-v2-11ee66b5c2670fda83c4d097"
    },
    {
      "action": "label",
      "previous_label": null,
      "previous_nomination": {
        "annotator": "local-reviewer",
        "provenance": "human_stage_0_review",
        "sample_sha256": "848cabbcee9e6b6bd712ab4085b8c2f5fb8b9198529dd62b2d76c899786e9c8b",
        "status": "VALID_TARGET",
        "timestamp_utc": "2026-10-06T16:17:37.402237+00:00"
      },
      "previous_skip": null,
      "sample_id": "real-v2-11ee66b5c2670fda83c4d097"
    },
    {
      "action": "nomination",
      "previous_label": null,
      "previous_nomination": null,
      "previous_skip": null,
      "sample_id": "real-v2-0cdab32110f63e34111b699f"
    },
    {
      "action": "label",
      "previous_label": null,
      "previous_nomination": {
        "annotator": "local-reviewer",
        "provenance": "human_stage_0_review",
        "sample_sha256": "b88a0a02f9dec2f71ae76fc0b76cea816fe889aa68145447307a73fd000d0afc",
        "status": "VALID_TARGET",
        "timestamp_utc": "2026-10-06T16:17:39.205184+00:00"
      },
      "previous_skip": null,
      "sample_id": "real-v2-0cdab32110f63e34111b699f"
    },
    {
      "action": "nomination",
      "previous_label": null,
      "previous_nomination": null,
      "previous_skip": null,
      "sample_id": "real-v2-17e7035055c6ab11a6adad02"
    },
    {
      "action": "label",
      "previous_label": null,
      "previous_nomination": {
        "annotator": "local-reviewer",
        "provenance": "human_stage_0_review",
        "sample_sha256": "7e4792d2ac29ea5135003f9e3473c76e25b99028a243e08e4156458278e0671d",
        "status": "VALID_TARGET",
        "timestamp_utc": "2026-10-06T16:17:41.004415+00:00"
      },
      "previous_skip": null,
      "sample_id": "real-v2-17e7035055c6ab11a6adad02"
    },
    {
      "action": "nomination",
      "previous_label": null,
      "previous_nomination": null,
      "previous_skip": null,
      "sample_id": "real-v2-0e5ed7bef7c9fb1924accbab"
    },
    {
      "action": "label",
      "previous_label": null,
      "previous_nomination": {
        "annotator": "local-reviewer",
        "provenance": "human_stage_0_review",
        "sample_sha256": "2d48518d7e9325af0e165e6886146b96b13d02d59dd43cc5a351074a88252978",
        "status": "VALID_TARGET",
        "timestamp_utc": "2026-10-06T16:17:42.741493+00:00"
      },
      "previous_skip": null,
      "sample_id": "real-v2-0e5ed7bef7c9fb1924accbab"
    },
    {
      "action": "nomination",
      "previous_label": null,
      "previous_nomination": null,
      "previous_skip": null,
      "sample_id": "real-v2-17891a0bfd994537f8e66e52"
    },
    {
      "action": "label",
      "previous_label": null,
      "previous_nomination": {
        "annotator": "local-reviewer",
        "provenance": "human_stage_0_review",
        "sample_sha256": "b8b7f7d2df020d442e21d3c499f4a095afa8943d41295c2edd59d379a2bf3a5a",
        "status": "VALID_TARGET",
        "timestamp_utc": "2026-10-06T16:17:44.643902+00:00"
      },
      "previous_skip": null,
      "sample_id": "real-v2-17891a0bfd994537f8e66e52"
    },
    {
      "action": "nomination",
      "previous_label": null,
      "previous_nomination": null,
      "previous_skip": null,
      "sample_id": "real-v2-030c245fca5937e9eb430bf4"
    },
    {
      "action": "label",
      "previous_label": null,
      "previous_nomination": {
        "annotator": "local-reviewer",
        "provenance": "human_stage_0_review",
        "sample_sha256": "f4896dada995f1eee4c347490bfee8a28ecc9739d164788c93cac4075aaf753f",
        "status": "VALID_TARGET",
        "timestamp_utc": "2026-10-06T16:17:46.501205+00:00"
      },
      "previous_skip": null,
      "sample_id": "real-v2-030c245fca5937e9eb430bf4"
    },
    {
      "action": "nomination",
      "previous_label": null,
      "previous_nomination": null,
      "previous_skip": null,
      "sample_id": "real-05af36a9be2c60d5c135013f"
    },
    {
      "action": "label",
      "previous_label": null,
      "previous_nomination": {
        "annotator": "local-reviewer",
        "provenance": "human_stage_0_review",
        "sample_sha256": "a3005b36e2d89e8f82bbf580482b34587e69e3d9afe375f691381dab1880a432",
        "status": "VALID_TARGET",
        "timestamp_utc": "2026-10-06T16:17:48.741139+00:00"
      },
      "previous_skip": null,
      "sample_id": "real-05af36a9be2c60d5c135013f"
    },
    {
      "action": "nomination",
      "previous_label": null,
      "previous_nomination": null,
      "previous_skip": null,
      "sample_id": "real-3bea6cbcf1e95ae4a42ad65a"
    },
    {
      "action": "label",
      "previous_label": null,
      "previous_nomination": {